{
  "$schema": "../plugin.schema.json",
  "name": "your-plugin-name",
  "version": "0.1.0",
  "description": "Short description of what this plugin does.",
  "author": "Your Name <you@example.com>",
  "license": "UNLICENSED",
  "keywords": ["field-engine", "plugin"],
  "entry": "src/index",
  "engines": {
    "fieldEngine": ">=1.0.0 <2.0.0"
  },
  "capabilities": [],
  "dependencies": {},
  "configSchema": "config.schema.json"
}
